data/captum_feature_attribution.csv

class,feature,signed_mean,abs_mean,rank
Benign,proto_num,0.138852,0.139084,1
Benign,https,0.09444,0.095203,2
Benign,ttl,0.065825,0.08464,3
Benign,ack,-0.044041,0.066111,4
Benign,psh,0.04629,0.056315,5
Benign,rate,0.049242,0.055974,6
Benign,ack_cnt,0.053021,0.053617,7
Benign,max,0.028974,0.046048,8
Benign,tot_size,0.005318,0.040156,9
Benign,avg,0.021231,0.036143,10
Benign,iat,0.029192,0.030495,11
Benign,min,0.020575,0.028869,12
Benign,std,0.012191,0.027829,13
Benign,header_len,0.014309,0.023637,14
Benign,var,-0.008299,0.020909,15
Benign,tot_sum,0.018552,0.020102,16
Benign,syn,0.011549,0.017439,17
Benign,num,0.007011,0.014338,18
Benign,syn_cnt,0.001092,0.012003,19
Benign,dns,0.002088,0.01099,20
Benign,fin,0.008732,0.010815,21
Benign,telnet,0.009667,0.010188,22
Benign,ece,0.005616,0.009868,23
Benign,tcp,0.008662,0.009121,24
Benign,rst_cnt,0.007292,0.008833,25
Benign,fin_cnt,0.005175,0.007584,26
Benign,ssh,0.006398,0.006996,27
Benign,rst,0.00409,0.005951,28
Benign,udp,0.004643,0.005645,29
Benign,cwr,0.000475,0.005623,30
Benign,ipv,0.004511,0.005523,31
Benign,smtp,0.004449,0.005381,32
Benign,http,0.001746,0.005271,33
Benign,irc,0.003686,0.005206,34
Benign,llc,0.002521,0.005126,35
Benign,igmp,-0.002249,0.003581,36
Benign,dhcp,0.001401,0.003398,37
Benign,icmp,0.000742,0.002999,38
Benign,arp,0.000198,0.002989,39
BruteForce,ssh,0.096191,0.097163,1
BruteForce,proto_num,0.079676,0.081212,2
BruteForce,psh,0.066923,0.073723,3
BruteForce,ttl,0.053017,0.055468,4
BruteForce,header_len,0.05408,0.054811,5
BruteForce,min,0.051538,0.052446,6
BruteForce,https,0.043473,0.048071,7
BruteForce,tot_size,0.041756,0.047964,8
BruteForce,max,0.042484,0.04649,9
BruteForce,irc,0.043373,0.044463,10
BruteForce,syn,0.036243,0.041734,11
BruteForce,ack_cnt,0.037833,0.040239,12
BruteForce,ack,-0.000782,0.038992,13
BruteForce,avg,0.024598,0.032474,14
BruteForce,rate,0.012388,0.030708,15
BruteForce,std,0.016502,0.027544,16
BruteForce,rst,0.016828,0.019657,17
BruteForce,var,-0.011,0.017067,18
BruteForce,iat,-0.000906,0.015895,19
BruteForce,num,0.009739,0.014481,20
BruteForce,tot_sum,-0.004731,0.013961,21
BruteForce,fin,0.010314,0.011682,22
BruteForce,dns,-0.00139,0.009105,23
BruteForce,syn_cnt,0.002034,0.008942,24
BruteForce,rst_cnt,0.004806,0.007477,25
BruteForce,ece,-3.9e-05,0.007171,26
BruteForce,smtp,0.006364,0.006778,27
BruteForce,telnet,0.004797,0.005771,28
BruteForce,fin_cnt,0.001669,0.00544,29
BruteForce,tcp,0.00244,0.005408,30
BruteForce,udp,0.000792,0.005389,31
BruteForce,arp,-0.001384,0.00482,32
BruteForce,cwr,-0.002667,0.004544,33
BruteForce,icmp,0.000933,0.004177,34
BruteForce,http,0.000948,0.004167,35
BruteForce,igmp,-0.003664,0.004067,36
BruteForce,llc,-0.000139,0.003954,37
BruteForce,ipv,-0.001371,0.003771,38
BruteForce,dhcp,0.000111,0.002775,39
DDoS,num,0.163497,0.163497,1
DDoS,var,0.063187,0.064791,2
DDoS,syn_cnt,0.049477,0.0502,3
DDoS,max,0.03842,0.046307,4
DDoS,proto_num,0.00937,0.043733,5
DDoS,iat,-0.002528,0.043123,6
DDoS,ack_cnt,0.030483,0.037839,7
DDoS,min,0.035518,0.035897,8
DDoS,tot_size,0.028633,0.035216,9
DDoS,fin_cnt,0.034222,0.034222,10
DDoS,rst_cnt,0.033197,0.033197,11
DDoS,avg,0.025899,0.031908,12
DDoS,header_len,-0.019433,0.026769,13
DDoS,rst,0.023009,0.024122,14
DDoS,rate,0.016672,0.021906,15
DDoS,psh,0.019402,0.020932,16
DDoS,dns,0.020013,0.020013,17
DDoS,ece,0.018007,0.018142,18
DDoS,std,0.015267,0.017417,19
DDoS,tot_sum,0.016357,0.017293,20
DDoS,ttl,-0.00513,0.01706,21
DDoS,https,0.014847,0.01496,22
DDoS,telnet,0.01433,0.014626,23
DDoS,cwr,0.013951,0.013951,24
DDoS,ack,0.010334,0.013655,25
DDoS,fin,0.005154,0.01309,26
DDoS,http,0.012437,0.012831,27
DDoS,irc,0.012196,0.012215,28
DDoS,syn,0.010497,0.011971,29
DDoS,ssh,0.010726,0.011745,30
DDoS,tcp,0.010585,0.010882,31
DDoS,arp,0.010024,0.010223,32
DDoS,igmp,0.009373,0.009492,33
DDoS,smtp,0.008419,0.00885,34
DDoS,ipv,0.007345,0.008368,35
DDoS,udp,0.0074,0.008365,36
DDoS,dhcp,0.007407,0.007807,37
DDoS,llc,0.006142,0.006958,38
DDoS,icmp,0.005742,0.006425,39
DoS,num,0.336736,0.336736,1
DoS,var,0.111397,0.116801,2
DoS,max,0.063301,0.065839,3
DoS,iat,0.022984,0.052007,4
DoS,header_len,0.033804,0.03833,5
DoS,min,0.03444,0.035241,6
DoS,avg,0.012793,0.031704,7
DoS,tot_size,-0.012732,0.030703,8
DoS,proto_num,-0.003712,0.028337,9
DoS,ttl,-0.026632,0.027527,10
DoS,ack_cnt,-0.005239,0.016158,11
DoS,rst_cnt,-0.010941,0.013896,12
DoS,std,-0.00955,0.01372,13
DoS,syn_cnt,-0.001422,0.013135,14
DoS,ack,-0.01019,0.012968,15
DoS,tot_sum,0.009876,0.012566,16
DoS,rst,-0.00415,0.011071,17
DoS,syn,-0.008945,0.010783,18
DoS,fin_cnt,-0.00851,0.010474,19
DoS,rate,0.000848,0.009464,20
DoS,psh,0.006028,0.009384,21
DoS,ssh,0.00155,0.009195,22
DoS,cwr,-0.007486,0.007889,23
DoS,tcp,0.000525,0.007603,24
DoS,udp,-0.005348,0.00712,25
DoS,fin,-0.0001,0.006757,26
DoS,https,-0.00394,0.006375,27
DoS,arp,0.00579,0.006263,28
DoS,ipv,0.002785,0.006066,29
DoS,ece,-0.00466,0.005998,30
DoS,llc,0.004125,0.005461,31
DoS,telnet,-0.0025,0.005372,32
DoS,igmp,0.00401,0.005105,33
DoS,smtp,-0.002327,0.005099,34
DoS,icmp,-0.000471,0.005044,35
DoS,dhcp,-0.000748,0.004038,36
DoS,dns,0.000179,0.003546,37
DoS,irc,0.000433,0.003476,38
DoS,http,-0.000926,0.002751,39
Mirai,tot_size,0.182613,0.182613,1
Mirai,max,0.169427,0.169528,2
Mirai,proto_num,0.069311,0.112558,3
Mirai,avg,0.108825,0.108825,4
Mirai,min,0.062167,0.083279,5
Mirai,num,0.026672,0.054978,6
Mirai,tot_sum,0.049446,0.049446,7
Mirai,iat,0.045141,0.047519,8
Mirai,var,0.034839,0.041407,9
Mirai,std,0.021233,0.023813,10
Mirai,ttl,0.011619,0.014957,11
Mirai,psh,0.002693,0.007802,12
Mirai,rate,-0.000254,0.006956,13
Mirai,header_len,-0.000363,0.006552,14
Mirai,rst_cnt,-0.005643,0.006367,15
Mirai,fin_cnt,-0.00548,0.005715,16
Mirai,ack_cnt,-0.004443,0.005447,17
Mirai,ack,0.000226,0.005343,18
Mirai,ece,-0.004516,0.004676,19
Mirai,udp,0.002288,0.004555,20
Mirai,arp,0.003806,0.0042,21
Mirai,syn_cnt,-0.00286,0.003963,22
Mirai,https,0.001605,0.003605,23
Mirai,telnet,-0.003246,0.003551,24
Mirai,llc,0.002985,0.003481,25
Mirai,syn,-0.00271,0.003428,26
Mirai,cwr,-0.002945,0.003351,27
Mirai,tcp,-0.000368,0.003146,28
Mirai,smtp,-0.002136,0.003074,29
Mirai,ipv,-0.001116,0.002976,30
Mirai,fin,0.001572,0.002895,31
Mirai,dhcp,0.000499,0.00286,32
Mirai,dns,0.001889,0.002829,33
Mirai,rst,0.001633,0.002785,34
Mirai,igmp,0.001181,0.002682,35
Mirai,ssh,-0.00138,0.002632,36
Mirai,icmp,0.00151,0.002624,37
Mirai,irc,-0.000939,0.002178,38
Mirai,http,-0.000428,0.001403,39
Recon,proto_num,0.126911,0.126911,1
Recon,syn,0.081496,0.088879,2
Recon,ack_cnt,0.081999,0.083835,3
Recon,ttl,0.062451,0.065123,4
Recon,header_len,0.050079,0.050977,5
Recon,ack,-0.020244,0.041177,6
Recon,rst,0.032585,0.036556,7
Recon,syn_cnt,0.032898,0.034559,8
Recon,fin,0.032317,0.034192,9
Recon,psh,0.023639,0.03314,10
Recon,min,0.021554,0.03268,11
Recon,tot_size,0.012,0.031209,12
Recon,max,-0.004612,0.029586,13
Recon,https,0.020276,0.026142,14
Recon,avg,-0.001501,0.025172,15
Recon,num,0.020818,0.024772,16
Recon,rate,0.012748,0.022988,17
Recon,iat,0.018897,0.022584,18
Recon,var,-0.009887,0.021764,19
Recon,http,0.02064,0.021345,20
Recon,std,-0.001924,0.01929,21
Recon,dns,0.006143,0.016353,22
Recon,tot_sum,0.011275,0.015882,23
Recon,fin_cnt,0.004075,0.010438,24
Recon,rst_cnt,0.005807,0.008045,25
Recon,ssh,0.00671,0.00757,26
Recon,telnet,0.006139,0.0068,27
Recon,ipv,0.005886,0.006614,28
Recon,tcp,-0.00094,0.00657,29
Recon,ece,0.00362,0.006486,30
Recon,llc,0.005792,0.006317,31
Recon,smtp,0.005237,0.005912,32
Recon,udp,0.003291,0.005883,33
Recon,dhcp,0.003881,0.004337,34
Recon,igmp,0.001092,0.004214,35
Recon,icmp,0.001625,0.004088,36
Recon,irc,0.000867,0.004009,37
Recon,arp,-0.001574,0.003926,38
Recon,cwr,0.001947,0.003674,39
Spoofing,proto_num,0.116386,0.116386,1
Spoofing,max,0.111995,0.114444,2
Spoofing,min,0.083167,0.094617,3
Spoofing,ttl,0.071642,0.075051,4
Spoofing,https,0.046003,0.046548,5
Spoofing,header_len,0.041524,0.041524,6
Spoofing,ack,-0.030641,0.039604,7
Spoofing,tot_size,0.026894,0.039239,8
Spoofing,psh,0.01278,0.036766,9
Spoofing,iat,0.035202,0.036238,10
Spoofing,avg,0.021222,0.034037,11
Spoofing,ack_cnt,0.002088,0.027048,12
Spoofing,rst_cnt,0.022245,0.022245,13
Spoofing,std,0.01202,0.020217,14
Spoofing,var,-0.000949,0.020111,15
Spoofing,tot_sum,0.01268,0.019451,16
Spoofing,num,0.013578,0.019023,17
Spoofing,rate,0.008901,0.016833,18
Spoofing,dns,0.014266,0.016158,19
Spoofing,syn_cnt,-0.010734,0.016044,20
Spoofing,telnet,0.014492,0.014605,21
Spoofing,fin,0.008251,0.013121,22
Spoofing,ssh,0.01112,0.011258,23
Spoofing,syn,0.001679,0.009748,24
Spoofing,fin_cnt,0.007972,0.00965,25
Spoofing,smtp,0.009563,0.009586,26
Spoofing,ece,0.007545,0.008591,27
Spoofing,llc,0.006817,0.008214,28
Spoofing,udp,0.007253,0.007857,29
Spoofing,rst,0.005737,0.007592,30
Spoofing,tcp,0.005988,0.00755,31
Spoofing,cwr,0.005228,0.00658,32
Spoofing,ipv,0.00605,0.006482,33
Spoofing,http,0.005396,0.006253,34
Spoofing,irc,0.005159,0.005869,35
Spoofing,dhcp,0.004806,0.005151,36
Spoofing,igmp,-0.002366,0.004353,37
Spoofing,icmp,0.00113,0.003176,38
Spoofing,arp,-0.000207,0.002783,39
Web,tot_size,0.099629,0.099987,1
Web,max,0.067313,0.081713,2
Web,avg,0.079154,0.081273,3
Web,ttl,0.057568,0.064364,4
Web,proto_num,0.051624,0.061004,5
Web,rate,0.045834,0.054914,6
Web,psh,0.038608,0.051205,7
Web,header_len,0.049986,0.049986,8
Web,ack_cnt,0.043328,0.046699,9
Web,min,-0.00223,0.046325,10
Web,std,0.038987,0.042326,11
Web,ack,-0.032677,0.039894,12
Web,https,0.017125,0.026008,13
Web,var,-0.016789,0.02545,14
Web,iat,0.017523,0.024323,15
Web,tot_sum,0.016392,0.0209,16
Web,num,0.013717,0.018401,17
Web,dns,-0.005524,0.016663,18
Web,syn_cnt,0.011707,0.015435,19
Web,syn,0.008342,0.013285,20
Web,fin,0.010331,0.011467,21
Web,ece,0.00778,0.010445,22
Web,udp,0.007597,0.008888,23
Web,http,0.005766,0.008554,24
Web,tcp,0.006413,0.007984,25
Web,rst,0.001789,0.007736,26
Web,rst_cnt,0.005781,0.007586,27
Web,fin_cnt,0.004014,0.006346,28
Web,ipv,0.005027,0.006185,29
Web,telnet,0.003636,0.005849,30
Web,llc,0.002925,0.005118,31
Web,ssh,0.001834,0.00486,32
Web,arp,0.000582,0.004664,33
Web,dhcp,0.002053,0.004636,34
Web,cwr,0.001791,0.004117,35
Web,icmp,0.001443,0.004065,36
Web,irc,0.000771,0.00393,37
Web,igmp,-0.002236,0.003825,38
Web,smtp,0.001812,0.003593,39

data/captum_top_features.md

## Benign

- `proto_num`  |attr|=0.1391  (+0.1389)
- `https`  |attr|=0.0952  (+0.0944)
- `ttl`  |attr|=0.0846  (+0.0658)
- `ack`  |attr|=0.0661  (-0.0440)
- `psh`  |attr|=0.0563  (+0.0463)
- `rate`  |attr|=0.0560  (+0.0492)
- `ack_cnt`  |attr|=0.0536  (+0.0530)
- `max`  |attr|=0.0460  (+0.0290)

## BruteForce

- `ssh`  |attr|=0.0972  (+0.0962)
- `proto_num`  |attr|=0.0812  (+0.0797)
- `psh`  |attr|=0.0737  (+0.0669)
- `ttl`  |attr|=0.0555  (+0.0530)
- `header_len`  |attr|=0.0548  (+0.0541)
- `min`  |attr|=0.0524  (+0.0515)
- `https`  |attr|=0.0481  (+0.0435)
- `tot_size`  |attr|=0.0480  (+0.0418)

## DDoS

- `num`  |attr|=0.1635  (+0.1635)
- `var`  |attr|=0.0648  (+0.0632)
- `syn_cnt`  |attr|=0.0502  (+0.0495)
- `max`  |attr|=0.0463  (+0.0384)
- `proto_num`  |attr|=0.0437  (+0.0094)
- `iat`  |attr|=0.0431  (-0.0025)
- `ack_cnt`  |attr|=0.0378  (+0.0305)
- `min`  |attr|=0.0359  (+0.0355)

## DoS

- `num`  |attr|=0.3367  (+0.3367)
- `var`  |attr|=0.1168  (+0.1114)
- `max`  |attr|=0.0658  (+0.0633)
- `iat`  |attr|=0.0520  (+0.0230)
- `header_len`  |attr|=0.0383  (+0.0338)
- `min`  |attr|=0.0352  (+0.0344)
- `avg`  |attr|=0.0317  (+0.0128)
- `tot_size`  |attr|=0.0307  (-0.0127)

## Mirai

- `tot_size`  |attr|=0.1826  (+0.1826)
- `max`  |attr|=0.1695  (+0.1694)
- `proto_num`  |attr|=0.1126  (+0.0693)
- `avg`  |attr|=0.1088  (+0.1088)
- `min`  |attr|=0.0833  (+0.0622)
- `num`  |attr|=0.0550  (+0.0267)
- `tot_sum`  |attr|=0.0494  (+0.0494)
- `iat`  |attr|=0.0475  (+0.0451)

## Recon

- `proto_num`  |attr|=0.1269  (+0.1269)
- `syn`  |attr|=0.0889  (+0.0815)
- `ack_cnt`  |attr|=0.0838  (+0.0820)
- `ttl`  |attr|=0.0651  (+0.0625)
- `header_len`  |attr|=0.0510  (+0.0501)
- `ack`  |attr|=0.0412  (-0.0202)
- `rst`  |attr|=0.0366  (+0.0326)
- `syn_cnt`  |attr|=0.0346  (+0.0329)

## Spoofing

- `proto_num`  |attr|=0.1164  (+0.1164)
- `max`  |attr|=0.1144  (+0.1120)
- `min`  |attr|=0.0946  (+0.0832)
- `ttl`  |attr|=0.0751  (+0.0716)
- `https`  |attr|=0.0465  (+0.0460)
- `header_len`  |attr|=0.0415  (+0.0415)
- `ack`  |attr|=0.0396  (-0.0306)
- `tot_size`  |attr|=0.0392  (+0.0269)

## Web

- `tot_size`  |attr|=0.1000  (+0.0996)
- `max`  |attr|=0.0817  (+0.0673)
- `avg`  |attr|=0.0813  (+0.0792)
- `ttl`  |attr|=0.0644  (+0.0576)
- `proto_num`  |attr|=0.0610  (+0.0516)
- `rate`  |attr|=0.0549  (+0.0458)
- `psh`  |attr|=0.0512  (+0.0386)
- `header_len`  |attr|=0.0500  (+0.0500)